{
  "schema_version": "section-session-meta-v1",
  "session_id": "section-session-a-2",
  "tenant_id": "tenant-a",
  "learner_id": "usr_learner_a",
  "programme_id": "programme-a",
  "course_id": "course-foundations",
  "week": 2,
  "lecture_id": "lecture-7-2",
  "section_pack_id": "section-pack-week-2",
  "approved_plan_id": "plan-tenant-a-7",
  "approved_plan_version": 4,
  "state": "guided_task",
  "resume": { "activity_id": "activity-example-1", "step_index": 1, "todo_acknowledged": false, "event_version": 3 },
  "issued_at": "2026-09-08T10:55:00Z",
  "expires_at": "2026-09-08T12:55:00Z"
}
